{
  "configPackId": "zj-gov-2026",
  "region": "浙江省",
  "configPackVersion": "2026.1.0",
  "policyBasis": [
    {
      "name": "资产管理 数据资产分类与代码",
      "docNumber": "GB/T 47949-2026",
      "coreRequirement": "数据资产分为结构化、半结构化、非结构化三小类，16项具体细类"
    },
    {
      "name": "资产管理 数据资产登记指南",
      "docNumber": "GB/T 47950-2026",
      "coreRequirement": "明确初始、变更和注销登记流程"
    },
    {
      "name": "行政许可事项办事指南编写规范",
      "docNumber": "国办发〔2015〕46号",
      "coreRequirement": "规范行政许可事项办事指南的编写要求"
    },
    {
      "name": "浙江省政务服务事项管理办法",
      "docNumber": "浙政办〔2024〕20号",
      "coreRequirement": "浙江省政务服务事项的标准化管理、办理流程规范化要求"
    },
    {
      "name": "浙江省数字化改革总体方案",
      "docNumber": "浙委改〔2021〕1号",
      "coreRequirement": "浙江省数字化改革框架与政务服务数字化要求"
    },
    {
      "name": "浙江省政务服务事项管理系统",
      "docNumber": "www.zjzwfw.gov.cn",
      "coreRequirement": "浙江省政务服务事项管理系统提供浙江省地方性事项的实施标准与办理规范等权威基准数据"
    }
  ],
  "requiredFields": [
    "事项名称",
    "实施主体",
    "办理条件",
    "申请材料",
    "办理流程",
    "办理时限",
    "收费标准",
    "办理地点",
    "咨询电话",
    "监督电话",
    "办理时间",
    "网上办理深度",
    "表格下载",
    "结果送达方式"
  ],
  "formatRules": [
    {
      "field": "办理时限",
      "pattern": "^\\d+个工作日$",
      "suggestionTemplate": "办理时限应使用\"X个工作日\"格式，如\"20个工作日\""
    },
    {
      "field": "咨询电话",
      "pattern": "^(\\d{3,4}-)?\\d{7,8}$",
      "suggestionTemplate": "咨询电话应使用\"区号-号码\"格式，如\"010-12345678\""
    },
    {
      "field": "收费标准",
      "requiredKeywords": [
        "不收费",
        "收费依据"
      ],
      "suggestionTemplate": "收费标准应注明\"不收费\"或\"金额+收费依据\""
    },
    {
      "field": "办理地点",
      "requiredKeywords": [
        "街道",
        "路",
        "号",
        "室",
        "楼",
        "层",
        "栋"
      ],
      "suggestionTemplate": "办理地点应包含具体地址信息(街道/路/号等)，不应仅用模糊描述"
    },
    {
      "field": "监督电话",
      "pattern": "^(\\d{3,4}-)?\\d{7,8}$",
      "suggestionTemplate": "监督电话应使用\"区号-号码\"格式，如\"010-12345678\""
    },
    {
      "field": "办理时间",
      "requiredKeywords": [
        "工作日",
        "上午",
        "下午",
        "周一至周五"
      ],
      "suggestionTemplate": "办理时间应注明工作日及上下午时段，如\"周一至周五 上午9:00-12:00 下午13:30-17:00\""
    }
  ],
  "localStandardTerms": {
    "materials": [
      "身份证原件",
      "身份证复印件",
      "户口簿原件",
      "户口簿复印件",
      "申请表",
      "营业执照复印件",
      "营业执照原件",
      "行政许可申请表",
      "组织机构代码证复印件",
      "税务登记证复印件",
      "法人身份证复印件",
      "授权委托书",
      "经办人身份证原件",
      "经办人身份证复印件",
      "房产证原件",
      "房产证复印件",
      "土地使用证原件",
      "土地使用证复印件",
      "规划许可证",
      "施工许可证",
      "环保审批文件",
      "消防验收合格证",
      "竣工验收备案表",
      "项目申请报告",
      "可行性研究报告",
      "环境影响评价报告",
      "资金证明",
      "银行资信证明",
      "财务审计报告",
      "验资报告",
      "公司章程",
      "股东会决议",
      "董事会决议",
      "合伙协议",
      "租赁合同",
      "购房合同",
      "社保缴纳证明",
      "纳税证明",
      "完税证明",
      "无犯罪记录证明",
      "健康证明",
      "学历证书",
      "学位证书",
      "职称证书",
      "执业资格证书",
      "工作证明",
      "收入证明",
      "居住证明",
      "婚姻状况证明",
      "亲属关系证明",
      "出生医学证明",
      "死亡证明",
      "户籍证明",
      "护照原件",
      "护照复印件",
      "签证",
      "居留许可",
      "出入境记录",
      "无房证明",
      "房产查询证明",
      "不动产登记证明",
      "预告登记证明",
      "抵押合同",
      "借款合同",
      "还款计划书",
      "收入流水",
      "银行流水",
      "存单",
      "存折",
      "股票账户证明",
      "基金账户证明",
      "保险单",
      "保单",
      "理赔证明",
      "医疗费用发票",
      "诊断证明",
      "病历",
      "出院小结",
      "手术记录",
      "检查报告",
      "检验报告",
      "处方",
      "用药清单",
      "康复证明",
      "残疾证",
      "低保证明",
      "特困证明",
      "优抚证明",
      "烈士证明",
      "军人证",
      "退役军人证",
      "转业证",
      "退伍证",
      "离退休证",
      "工作证",
      "介绍信",
      "调档函",
      "政审材料",
      "体检报告",
      "无违纪证明",
      "学籍证明",
      "在读证明",
      "毕业证",
      "结业证",
      "肄业证",
      "成绩单",
      "学历认证报告",
      "学位认证报告",
      "留学回国人员证明",
      "国外学历认证",
      "语言能力证明",
      "计算机等级证书",
      "英语等级证书",
      "职业培训证书",
      "技能等级证书",
      "特种作业操作证",
      "安全生产考核合格证",
      "驾驶员驾驶证",
      "行驶证",
      "车辆登记证",
      "购车发票",
      "车辆保险单",
      "交通事故责任认定书",
      "维修发票",
      "评估报告",
      "鉴定报告",
      "公证书",
      "法律意见书",
      "律师函",
      "法院判决书",
      "调解书",
      "仲裁裁决书",
      "执行裁定书",
      "破产裁定书",
      "清算报告",
      "注销登记证明",
      "变更登记证明",
      "迁移证明",
      "准迁证",
      "暂住证",
      "居住证",
      "租房合同",
      "房屋租赁备案证明",
      "物业费缴纳证明",
      "水电费缴纳证明",
      "燃气费缴纳证明",
      "供暖费缴纳证明",
      "宽带安装证明",
      "有线电视安装证明",
      "停车位租赁合同",
      "车位产权证",
      "车库产权证",
      "电梯使用证",
      "公共维修基金缴纳证明",
      "专项维修资金缴纳证明",
      "住宅专项维修资金交存证明",
      "住房公积金缴存证明",
      "住房公积金提取申请表",
      "住房公积金贷款申请表",
      "公积金贷款合同",
      "商业贷款合同",
      "组合贷款合同",
      "贷款结清证明",
      "贷款还款明细",
      "提前还款申请表",
      "贷款展期申请表",
      "贷款变更申请表",
      "担保合同",
      "保证合同",
      "质押合同",
      "抵押注销登记证明",
      "不动产查档证明",
      "不动产登记查询结果",
      "权属证明",
      "共有权证明",
      "继承公证书",
      "赠与公证书",
      "析产协议",
      "分割协议",
      "赔偿协议",
      "补偿协议",
      "安置协议",
      "拆迁协议",
      "征收决定",
      "补偿决定",
      "评估报告书",
      "分户评估报告",
      "整体评估报告",
      "征收补偿方案",
      "安置房选房确认书",
      "货币补偿确认书",
      "产权调换确认书",
      "回迁安置协议",
      "异地安置协议",
      "货币安置协议",
      "周转房租赁合同",
      "临时安置补助协议",
      "搬迁补助协议",
      "停产停业损失补偿协议",
      "装饰装修补偿协议",
      "附属物补偿协议",
      "树木补偿协议",
      "青苗补偿协议",
      "地上附着物补偿协议",
      "土地使用权出让合同",
      "土地使用权转让合同",
      "土地使用权租赁合同",
      "土地使用权抵押合同",
      "国有土地使用证",
      "集体土地使用证",
      "土地承包经营权证",
      "土地流转合同",
      "林地使用权证",
      "草原使用权证",
      "水域滩涂养殖证",
      "捕捞许可证",
      "采矿许可证",
      "探矿许可证",
      "取水许可证",
      "排污许可证",
      "危险废物经营许可证",
      "辐射安全许可证",
      "安全生产许可证",
      "食品经营许可证",
      "食品生产许可证",
      "药品经营许可证",
      "药品生产许可证",
      "医疗器械经营许可证",
      "医疗器械生产许可证",
      "化妆品生产许可证",
      "特种设备使用登记证",
      "特种设备作业人员证",
      "电梯维保资质",
      "锅炉使用证",
      "压力容器使用证",
      "起重机械使用证",
      "场内机动车辆使用证",
      "客运索道使用证",
      "大型游乐设施使用证",
      "建筑工程施工许可证",
      "建筑工程规划许可证",
      "建设用地规划许可证",
      "建设工程规划许可证",
      "乡村建设规划许可证",
      "临时建设工程规划许可证",
      "选址意见书",
      "用地预审意见",
      "环评批复",
      "能评批复",
      "水保批复",
      "洪评批复",
      "地震安全性评价报告",
      "地质灾害危险性评估报告",
      "土壤污染状况调查报告",
      "土壤修复方案",
      "应急预案",
      "应急预案备案证明",
      "安全评价报告",
      "职业病危害评价报告",
      "安全设施竣工验收报告",
      "环保竣工验收报告",
      "消防设计审查意见书",
      "消防验收意见书",
      "消防备案凭证",
      "人防审批意见书",
      "人防竣工验收备案表",
      "防雷装置检测报告",
      "防雷合格证",
      "白蚁防治证明",
      "房屋安全鉴定报告",
      "房屋完损等级评定报告",
      "房屋抗震鉴定报告",
      "房屋消防鉴定报告",
      "电梯检验报告",
      "电梯安全检验合格证",
      "锅炉检验报告",
      "压力容器检验报告",
      "起重机械检验报告",
      "电梯定期检验报告",
      "锅炉定期检验报告",
      "压力容器定期检验报告",
      "起重机械定期检验报告"
    ],
    "conditions": [
      "年满18周岁",
      "年满十八周岁",
      "须为成年人",
      "具有完全民事行为能力",
      "符合法定条件",
      "符合法定年龄",
      "达到法定婚龄",
      "男满22周岁",
      "女满20周岁",
      "具有本地户籍",
      "具有本地居住证",
      "在本地连续居住满一年",
      "在本市工作并缴纳社保",
      "在本市连续缴纳社保满一年",
      "在本市连续缴纳社保满五年",
      "在本市连续缴纳公积金满一年",
      "在本市连续缴纳公积金满五年",
      "在本市连续纳税满三年",
      "在本市有合法稳定住所",
      "在本市有合法稳定就业",
      "在本市无自有住房",
      "家庭人均收入低于当地标准",
      "家庭财产低于当地标准",
      "属于低收入家庭",
      "属于中等偏下收入家庭",
      "属于特困人员",
      "属于低保对象",
      "属于优抚对象",
      "属于残疾人",
      "属于老年人",
      "属于未成年人",
      "属于孕产妇",
      "属于退役军人",
      "属于现役军人家属",
      "属于烈士遗属",
      "属于因公牺牲军人遗属",
      "属于病故军人遗属",
      "属于归侨侨眷",
      "属于港澳台居民",
      "属于华侨",
      "属于外籍人士",
      "属于高层次人才",
      "属于紧缺急需人才",
      "属于新引进人才",
      "属于创新创业人才",
      "属于高校毕业生",
      "属于职业院校毕业生",
      "属于技工院校毕业生",
      "属于留学回国人员",
      "属于退役军人",
      "属于失业人员",
      "属于就业困难人员",
      "属于灵活就业人员",
      "属于新型职业农民",
      "属于农村转移劳动力",
      "属于建档立卡贫困户",
      "属于易地扶贫搬迁对象",
      "属于水库移民",
      "属于受灾群众",
      "属于见义勇为人员",
      "属于道德模范",
      "属于劳动模范",
      "属于先进工作者",
      "属于优秀教师",
      "属于优秀医务工作者",
      "属于优秀科技工作者",
      "属于优秀文化工作者",
      "属于优秀体育工作者",
      "属于优秀志愿者",
      "属于优秀社工",
      "属于优秀护工",
      "属于优秀保姆",
      "属于优秀月嫂",
      "属于优秀育婴师",
      "属于优秀保育员",
      "属于优秀养老护理员",
      "属于优秀康复治疗师",
      "属于优秀心理咨询师",
      "属于优秀营养师",
      "属于优秀健身教练",
      "属于优秀美容师",
      "属于优秀美发师",
      "属于优秀美甲师",
      "属于优秀纹绣师",
      "属于优秀化妆师",
      "属于优秀摄影师",
      "属于优秀摄像师",
      "属于优秀播音员",
      "属于优秀主持人",
      "属于优秀记者",
      "属于优秀编辑",
      "属于优秀翻译",
      "属于优秀导游",
      "属于优秀导购",
      "属于优秀收银员",
      "属于优秀理货员",
      "属于优秀仓管员",
      "属于优秀叉车工",
      "属于优秀焊工",
      "属于优秀电工",
      "属于优秀钳工",
      "属于优秀车工",
      "属于优秀铣工",
      "属于优秀磨工",
      "属于优秀镗工",
      "属于优秀刨工",
      "属于优秀钻工",
      "属于优秀冲压工",
      "属于优秀锻造工",
      "属于优秀铸造工",
      "属于优秀热处理工",
      "属于优秀电镀工",
      "属于优秀喷漆工",
      "属于优秀注塑工",
      "属于优秀挤出工",
      "属于优秀纺纱工",
      "属于优秀织布工",
      "属于优秀印染工",
      "属于优秀缝纫工",
      "属于优秀裁剪工",
      "属于优秀制鞋工",
      "属于优秀制帽工",
      "属于优秀制包工",
      "属于优秀制衣工",
      "属于优秀服装设计师",
      "属于优秀平面设计师",
      "属于优秀室内设计师",
      "属于优秀建筑设计师",
      "属于优秀景观设计师",
      "属于优秀工业设计师",
      "属于优秀UI设计师",
      "属于优秀UX设计师",
      "属于优秀产品经理",
      "属于优秀项目经理",
      "属于优秀测试工程师",
      "属于优秀运维工程师",
      "属于优秀开发工程师",
      "属于优秀算法工程师",
      "属于优秀数据工程师",
      "属于优秀数据分析师",
      "属于优秀数据科学家",
      "属于优秀人工智能工程师",
      "属于优秀机器学习工程师",
      "属于优秀深度学习工程师",
      "属于优秀自然语言处理工程师",
      "属于优秀计算机视觉工程师",
      "属于优秀语音识别工程师",
      "属于优秀图像识别工程师",
      "属于优秀人脸识别工程师",
      "属于优秀指纹识别工程师",
      "属于优秀虹膜识别工程师",
      "属于优秀步态识别工程师",
      "属于优秀行为识别工程师",
      "属于优秀姿态识别工程师",
      "属于优秀目标检测工程师",
      "属于优秀目标跟踪工程师",
      "属于优秀目标分割工程师",
      "属于优秀图像分割工程师",
      "属于优秀图像恢复工程师",
      "属于优秀图像增强工程师",
      "属于优秀图像去噪工程师",
      "属于优秀图像超分辨率工程师",
      "属于优秀图像修复工程师",
      "属于优秀图像生成工程师",
      "属于优秀图像编辑工程师",
      "属于优秀图像合成工程师",
      "属于优秀图像融合工程师",
      "属于优秀图像配准工程师",
      "属于优秀图像拼接工程师",
      "属于优秀三维重建工程师",
      "属于优秀三维建模工程师",
      "属于优秀三维渲染工程师",
      "属于优秀三维动画工程师",
      "属于优秀三维打印工程师",
      "属于优秀虚拟现实工程师",
      "属于优秀增强现实工程师",
      "属于优秀混合现实工程师",
      "属于优秀元宇宙工程师",
      "属于优秀区块链工程师",